{
  "contract_version": "track-b.event.v1alpha1",
  "event_id": "00000000-0000-4000-8000-000000000101",
  "event_type": "resource.changed",
  "occurred_at": "2026-08-16T00:02:00Z",
  "domain_id": "default",
  "project_id": "00000000-0000-4000-8000-000000000010",
  "actor_id": "00000000-0000-4000-8000-000000000011",
  "resource": {"type": "restore-drill", "id": "00000000-0000-4000-8000-000000000020"},
  "severity": "ERROR",
  "operation_id": "00000000-0000-4000-8000-000000000001",
  "correlation_id": "00000000-0000-4000-8000-000000000002",
  "request_id": "req-track-c-fixture-1",
  "payload": {"action": "restore-drill.failed", "outcome": "failed", "cleanup_required": true}
}
